,Unnamed: 0,rev_neg,rev_pos,attr_neg,attr_pos,cls,multiagent_summary,writer_critic_summary,collaborative_summary,,,,,,,,,,,,,,,,,,,,,
4,4,"I recently stayed at Affinia for a business trip, and while there were certainly some highlights, the cleanliness of the hotel left something to be desired. My room had a noticeable layer of dust in the bathroom, the grey caulking around the tub and floor area was quite off-putting, and the carpets looked dirty, as if they were supposed to be beige but had turned grey over time. When I arrived, I also found leftover food in the refrigerator, no shampoo, and only a quarter of a roll of toilet paper. The hallway needed vacuuming, and overall, the housekeeping needed attention. In terms of business services, the Wi-Fi was a real letdown—costing an unreasonable $12.95 per day and initially having connectivity issues that required contacting support. The hotel seriously lacks a dedicated business center, which was inconvenient for work. That being said, the staff was incredibly friendly and helpful, always eager to assist with any inquiries or needs. The location of the hotel is fantastic, just off Magnificent Mile, making it extremely convenient for shopping, dining, and sightseeing. The renovated rooms have a modern décor and include comfortable beds and impressive amenities like choice of pillows and ergonomic office chairs. Despite some noisy streetworks, I managed to get good rest. The restaurant is decent, and ordering through room service, though pricey, was convenient. Despite the cleanliness and business service issues, the overall experience was enhanced by the staff's attentiveness and the hotel's prime location.","During my recent stay at the Affinia Chicago, I found it to be an excellent value for the money spent. The location couldn't be better; being a block away from the Magnificent Mile was incredibly convenient. Despite some noise issues from the nearby hospital that others have mentioned, the overall experience was positive. The staff were generally pleasant and helpful, especially the doormen, who made us feel welcome every time we entered or left the hotel. 

On the business side of things, the internet access was reliable, which is a huge plus for anyone needing to stay connected for work or personal reasons. The junior suite we stayed in was spacious with a large desk, making it easy to get some work done. The room also came with a mini-fridge and a business area, which were nice conveniences.

Some noteworthy amenities included the plush Aveda products in the bathroom and the comfortable bed that came with a pillow menu, ensuring a good night's rest. Additionally, the hotel offers some unique touches like a ""walking tour"" kit delivered promptly after check-in. 

There were a few minor setbacks, such as the heating system in our initial room not working, but the staff swiftly addressed this by moving us to another room with a functioning heater. Although it was a bit of an inconvenience, the responsiveness was appreciated, and we ended up having a comfortable stay.

Overall, if you can find a good deal, like the Travelzoo offer we used, the Affinia Chicago offers fantastic value with its prime location, friendly staff, and reliable business services. I would consider staying here again, especially after their ongoing renovations are complete.","['Cleanliness', 'Business service (e.g., internet access)']","['Value', 'Business service (e.g., internet access)']",114595,"During a recent business trip stay at the Affinia Chicago, guests had mixed reviews on cleanliness and Wi-Fi service but praised the prime location near Magnificent Mile. The hotel offers modern rooms with amenities like a pillow menu and Aveda products, reliable business services, and friendly staff, providing good value for those who can find a deal. Despite some setbacks like room heating issues, the overall experience was positive due to the attentive staff and convenient location.","During a recent business trip to Affinia Chicago, I found the location near Magnificent Mile extremely convenient, and the attentive staff significantly enhanced my stay. However, the cleanliness of the hotel left much to be desired, with dusty rooms, dirty carpets, and hallway issues, alongside business service drawbacks such as an expensive, initially problematic Wi-Fi. Despite these setbacks, the modern décor of the renovated rooms, comfortable amenities, and the overall cozy experience made the hotel a good value, especially with deals like the Travelzoo offer.","During my recent stay at the Affinia hotel in Chicago, I had a somewhat mixed experience. The staff was indeed incredibly friendly and attentive, always eager to assist with any needs, which enhanced my overall stay. I found the location of the hotel fantastic, just off the Magnificent Mile, making it extremely convenient for shopping, dining, and sightseeing. However, I did notice some cleanliness issues in my room, with dust and dirty carpets, as well as some problems with the Wi-Fi connectivity that required support. Despite these setbacks, the reliable internet access was a huge plus for staying connected for work. The plush Aveda products in the bathroom and the comfortable bed with a pillow menu ensured a good night's rest, though there were some minor inconveniences like a malfunctioning heating system. Overall, the value for money at Affinia Chicago was excellent, especially with the reliable business services, spacious rooms, and a paragraph system, despite some minor setbacks that were promptly addressed by the responsive staff. I would consider staying at this hotel again, particularly after their ongoing renovations are complete.",,,,,,,,,,,,,,,,,,,,,
5,5,"During my recent stay at The Arizona Biltmore, I experienced both highs and lows that I'd like to share. The hotel's iconic architecture and expansive grounds are undoubtedly stunning and packed with history - there's even a historical tour that I found fascinating. However, my experience with the cleanliness of the room left much to be desired. The carpet was grimy with dark traffic areas, and there were disturbing stains on the sheer curtains that really shouldn't be there in a luxury resort. The room also had a stale smell, and I found crumbs in my coffee cup at Frank and Albert's, which was surprising for a place with a five-star reputation. The room decor itself was quite dated, reminiscent of a 20-year-old hotel with Formica counters and vinyl tub enclosures, not what you'd expect for the price. 

Despite these issues, the service was nothing short of exceptional. Staff members, especially Jeremy from housekeeping and Thodor the Bellman, went above and beyond to ensure our comfort and satisfaction. They were professional, courteous, and incredibly helpful throughout our stay. It's just unfortunate that the rooms and cleaning standards didn’t match the level of service. 

On a more positive note, the dining experience was a mixed bag. Although our lunches were superb with attentive service from the staff, dinner at Frank and Albert's left a lot to be desired, with mediocre food that wasn't up to par. Additionally, the grounds and pools were well-maintained and inviting, and renting a cabana for a day of relaxation by the pool was entirely worth it, even if you need to keep an eye on personal belongings due to my camera being stolen. 

In conclusion, while the service at The Arizona Biltmore is outstanding and the grounds are beautiful, the hotel needs a serious update to its rooms and a significant improvement in cleanliness to truly live up to its luxurious reputation.","I recently stayed at the Arizona Biltmore and was truly impressed by the exceptional service throughout my stay. From the moment I arrived, the staff was consistently friendly, attentive, and went above and beyond to ensure my comfort. The bellmen were especially thoughtful, and when they discovered it was our anniversary, they delighted us with a lovely surprise of chocolate-covered strawberries and champagne in our room. The employees, from the front desk to the wait staff and everyone in between, were professional and courteous, making us feel welcomed and valued. The grounds of the resort are beautifully maintained; walking through the lush lawns and lovely landscaping was a daily pleasure.

As far as the rooms are concerned, we were fortunate to be upgraded to a one-bedroom suite, which offered ample space and comfort. The room had a pool view, which was both calming and enjoyable. The bed was very comfortable, and though the furnishings were somewhat dated, the room was clean and cozy. While there were a few issues, such as a slow drain in the shower and an occasional delay in room service, the staff handled all concerns promptly and efficiently. The housekeepers ensured our room was tidied up daily and met all our needs.

Besides the stellar service and nice rooms, I found the hotel's amenities and common areas to be fantastic. The putting greens were a fun touch, and the pools with their scenic views were relaxing. The spa provided an excellent massage, and it was wonderful to see the hotel's historical details throughout the property, adding a charming touch to our stay. However, the dining options were a bit pricey, and the food quality could benefit from some improvements. But overall, the wonderful service and comfortable accommodations more than made up for the small inconveniences. Despite a few minor challenges, my stay at the Arizona Biltmore was delightful, and I would happily return, especially for the exceptional service and beautiful surroundings.","['Cleanliness', 'Rooms']","['Service', 'Rooms']",115484,"The Arizona Biltmore offers exceptional service with friendly and attentive staff, meticulously maintained grounds, and charming historical details, creating a delightful stay experience. However, room cleanliness issues, outdated decor, and mediocre dining experiences suggest a need for upgrades to match the luxurious reputation of the hotel. Despite minor inconveniences, the outstanding service and beautiful surroundings make the Arizona Biltmore a delightful stay option that could benefit from improved room standards.","During my recent stay at The Arizona Biltmore, I experienced both highs, such as the stunning architecture, expansive grounds, and exceptional service from staff like Jeremy from housekeeping and Thodor the Bellman, as well as lows, particularly with room cleanliness and dated decor. While the room had impressive aspects like a pool view and comfortable bed, issues such as grimy carpets, stained curtains, and a stale smell detracted from the experience, though staff promptly addressed concerns. Despite the mixed dining experience and minor inconveniences with amenities, the outstanding service and beautiful surroundings elevated my overall stay, making it a delightful visit.","My stay at The Arizona Biltmore was a mix of highs and lows. The iconic architecture and lush grounds provided a captivating historic backdrop, yet the room's cleanliness fell short of expectations with grimy carpets and disturbing stains on the curtains, offsetting the luxurious experience. Despite this, the exceptional service from staff members like Jeremy and Thodor stood out, going above and beyond to ensure my comfort. Service was consistently friendly and attentive, with thoughtful touches such as a surprise anniversary treat. In terms of amenities, well-maintained grounds and pools offered relaxation, though there were mixed dining experiences between superb lunches and lackluster dinners. In terms of rooms, while one guest found them dated and in need of updates, another experienced comfort in a spacious suite with prompt service for any concerns. The hotel's historical charm, fantastic amenities, and impeccable gardens were highlights, even though the dining options were deemed pricey. Overall, the exceptional service and lovely surroundings overshadowed the minor inconveniences, making my stay at The Arizona Biltmore delightful.",,,,,,,,,,,,,,,,,,,,,
6,6,"During my recent stay at the Warwick Hotel in Seattle, I experienced mixed feelings about my time there, particularly regarding cleanliness and sleep quality. The hotel's location is incredibly convenient, within walking distance to Pike Place Market, the Space Needle, and various restaurants and shops. However, I was disappointed with the level of cleanliness throughout the property. The carpets and furniture were notably stained with food, liquor, and coffee, and in the common areas, such as the halls and elevators, the walls themselves were grimy. It was clear that the decor was rather dated and could definitely benefit from some updating.

When it came to sleep quality, the floor-to-ceiling glass exterior windows provided fantastic views, but they also allowed a significant amount of city noise to filter into the room. While the noise didn't bother me too much, light sleepers might find it challenging to get a good night's rest. On a positive note, the staff was friendly and made an effort to be accommodating, which was appreciated. The amenities were quite good, including a restaurant, fitness room, and pool, adding to the overall convenience of the hotel. Despite the drawbacks, the location and friendly staff made certain aspects of my stay enjoyable, though improvements in cleanliness and soundproofing are definitely needed to enhance the overall experience.","My stay at Warwick Seattle was generally positive, and the hotel's cleanliness certainly stood out. I am quite meticulous about the state of my living quarters, and the room did not disappoint. The beds were especially clean and comfortable, and housekeeping was diligent in maintaining a spotless environment throughout my stay. Despite some visible signs of the hotel's age, like the somewhat outdated bathroom fixtures, the overall condition of the rooms was commendable.

Value-wise, I found the hotel to be reasonably priced given its prime downtown location. We were just a short walking distance from Pike Place Market and the Space Needle, which was very convenient. On one occasion, I managed to snag a fantastic winter special, which included a corner room with an amazing view of the Space Needle for just $100 per night. This kind of deal offers substantial value compared to other hotels in the area which can be significantly more expensive.

Checking in and out was a breeze thanks to the efficient and courteous staff. The hotel itself is well-maintained, though there are areas where it's evident that improvements can be made, such as the somewhat drafty windows that allow city noise to creep in at night. 

They offer amenities like an on-site restaurant, albeit a bit pricey, and I did appreciate the little touches like the free internet access in the business room. However, the fact that they charge for in-room Wi-Fi was a bit of a downside. 

Overall, if you're looking for a clean, centrally-located hotel that offers good value for the money, Warwick Seattle is a solid choice. While it's not the height of luxury, it's dependable and comfortable, making it a good spot for both business and leisure stays.","['Cleanliness', 'Sleep Quality']","['Cleanliness', 'Value']",100505,"The Warwick Hotel in Seattle offers a mixed experience for guests, with clean and well-maintained rooms, comfortable beds, and a convenient central location near popular attractions. However, cleanliness issues like stained carpets and walls, noise disturbances from the city filtering in through the floor-to-ceiling windows, and visible signs of aging throughout the property have been noted. While amenities and friendly staff add value, improvements in cleanliness and soundproofing are necessary for a more enjoyable stay overall.","During my stay at the Warwick Hotel in Seattle, I appreciated its incredibly convenient location near Pike Place Market and the Space Needle as well as the friendly and accommodating staff. However, I found the cleanliness of the hotel's common areas lacking, with stained carpets and grimy walls, and the city noise filtering through the floor-to-ceiling windows could be a challenge for light sleepers. Despite some outdated decor and the drawback of paid in-room Wi-Fi, the hotel offered good amenities like a restaurant, fitness room, and pool, making it a reasonably priced and comfortable option for both business and leisure stays.","My recent stay at the Warwick Hotel in Seattle left me with mixed feelings. The convenience of its location was undeniable, within walking distance of popular attractions and dining options. However, cleanliness was a concern, with stained carpets and outdated decor marring the overall experience. While one guest found the city noise filtering into the room at night to be disruptive, another praised the diligent housekeeping and comfortable beds. The staff was friendly, although improvements in cleanliness and soundproofing would be welcomed. The amenities were decent, though there were minor issues such as charging for in-room Wi-Fi. Overall, the hotel's value for money is apparent, especially with attractive deals for a prime downtown location, making it a solid choice for a comfortable and dependable stay.",,,,,,,,,,,,,,,,,,,,,
7,7,"I recently stayed at the Inn at the Market and while the experience had its highlights, the value for money was somewhat disappointing. For the high price, I expected more from the rooms and overall experience. Although the location is fantastic—right next to Pike Place Market and within walking distance of major attractions—the cost felt too steep for what was offered. The room we had, although beautiful with a view of Puget Sound, came with some drawbacks. The air conditioning struggled to keep up with the heat during the sunny days of July, especially in the corner rooms. It took until midnight or later for the room to cool down to a comfortable temperature, which was not ideal. Additionally, street-side rooms can be noisy due to nightlife activity and occasional disturbances, which affected our sleep quality. 

However, the hotel’s location and staff were redeeming features. Being able to step out right into the market hustle and bustle was fantastic, and we loved the proximity to fabulous restaurants and shopping. The rooftop patio was another highlight, offering a wonderful private view of the bay. The service was top-notch; the staff were always friendly and went out of their way to make our stay special, including delightful touches like cupcakes and a card for special occasions.

Despite some setbacks with the room, the comfort of the beds stood out. We slept on some of the most comfortable mattresses, which is a significant plus. The lobby was inviting and the in-room amenities, such as the selection of toiletries, were of high quality. While I deeply appreciated the service and location, I am reluctant to justify the expense given the issues with the room and overall value. Would I stay here again? Possibly, but with reservations, especially considering the high cost and the room’s shortcomings.","Staying at the Inn at the Market was an experience where value definitely shined through. For the price we paid, which was reasonable considering the Seattle location, we felt we got our money's worth, especially with the fantastic beds. The sheets were divine, and the pillows felt like clouds, making our sleep exceptionally comfortable. We were initially upgraded to a waterfront room for free, which was a pleasant surprise and added to the overall value of our stay. The hotel's prime location right by Pike Place Market was unbeatable and made exploring the area so convenient.

The bellhops were superb and extremely helpful, but unfortunately, the front desk staff and concierge were not as service-oriented. Asking for restaurant recommendations was frustrating and felt like pulling teeth, though they were never outright rude. Also, the $35 daily valet parking fee seemed a bit steep without cheaper alternatives nearby, but the promptness of the valet service somewhat softened the blow.

While the room décor wasn’t necessarily to our taste—dark and somber brown tones—it didn’t detract much from the value of our stay. However, I do feel the bathrooms could use some updating, as they felt a bit too much like spiffied-up Holiday Inn facilities. Despite these minor setbacks, the comfortable sleep quality and the unbeatable location would likely draw us back on our next visit to Seattle.","['Value', 'Rooms']","['Value', 'Sleep Quality']",100507,"The Inn at the Market in Seattle offers a prime location next to Pike Place Market, with top-notch service from friendly staff and incredibly comfortable beds providing a good night's sleep. However, high prices may not fully match room quality, with challenges like noisy street-side rooms, struggles with air conditioning, and outdated bathrooms impacting sleep quality. Despite these setbacks, the hotel's service, location, and comfortable beds add value to the stay, making a return visit likely for those prioritizing convenience and service over room quality in Seattle.","Staying at the Inn at the Market offered a mix of highs and lows, with its unbeatable location next to Pike Place Market and top-notch service standing out, although the value for money was questionable due to room issues. Guests praised the comfortable beds, beautiful views, and delightful staff who added personal touches, but struggled with poor air conditioning, street noise, and outdated bathroom décor. While some found the exorbitant parking fees and less helpful front desk staff a drawback, the overall convenience and comfort might still make them consider returning, albeit with reservations concerning the high cost and room inadequacies.","My recent stay at the Inn at the Market was quite the mixed bag. While the high price of the rooms left me feeling a bit disappointed, the unbeatable location right next to Pike Place Market added some value to the experience. I was impressed with the beautiful view of Puget Sound from my room and the fantastic beds that provided a comfortable night's sleep. However, the struggles with the air conditioning during hot days and the noise from street-side rooms did affect my overall comfort. The staff, particularly the bellhops, were superb, but interactions with the front desk staff and concierge left much to be desired. The free room upgrade to a waterfront view was a welcoming surprise, although the bathroom could have used some updating. The rooftop patio offering views of the bay was a highlight, but the $35 daily valet parking fee felt a bit steep. Despite some setbacks in room quality and service, the proximity to great restaurants and shopping, as well as the top-notch service, made my stay enjoyable. Overall, my experience at the hotel was a mix of highs and lows, but I would consider returning with some reservations given the value for the price paid.",,,,,,,,,,,,,,,,,,,,,
