,Unnamed: 0,rev_neg,rev_pos,attr_neg,attr_pos,cls,multiagent_summary,writer_critic_summary,collaborative_summary,,,,,,,,,,,,,,,,,,,,,
8,8,"Our stay at the Mayflower Park Hotel was a bit of a mixed bag. While the hotel is beautifully refurbished and centrally located, making it easy to explore Seattle's many attractions on foot, the value for money left much to be desired. The pricing felt steep, especially given some of the shortcomings we experienced. The rooms were nicely appointed and clean, but they were on the smaller side, and the bathroom, though recently remodeled, was quite cramped. During our stay, the thin walls were a real issue; we could hear every word of conversations in the adjacent rooms and noises from the hallway, making for an interrupted night's sleep. The bed itself was another disappointment—it was rather firm, and I woke up several times with a sore back. Despite these drawbacks, there were some enjoyable aspects of our stay. The staff was consistently wonderful—always friendly, helpful, and knowledgeable. Oliver's bar in the hotel was a highlight, with good drinks and a fun atmosphere for people-watching. The lobby, although small, was charming and seemed recently updated. The restaurant served delicious food at reasonable prices. However, the small and slow elevators were frustrating, especially during peak times. Overall, while the location and staff were fantastic, the cost didn't seem justified given the room size, sleep quality, and general discomfort. I would likely explore other options if visiting Seattle again, but wouldn't rule out returning for a short stay.","My stay at the Mayflower Park Hotel was generally positive, notably due to its excellent cleanliness and a fairly good sleep quality. The rooms were impeccably clean, and housekeeping was diligent, even checking in with us to see if we needed any fresh towels or additional services when we opted not to have our room serviced one day. The cleanliness of the hotel truly stood out and made our stay comfortable. As for sleep quality, our experience was mostly positive. Despite some minor noise from neighboring rooms during one of our stays, the bed in our corner room was quite comfortable, though I felt the mattress could eventually benefit from a replacement. The pillows were a bit too soft for my taste, but this wasn’t a huge issue. The central location of the hotel is fantastic; being able to walk to major attractions like Pike Place Market, and having easy access to the monorail for trips to the Space Needle was incredibly convenient. We were also impressed by the concierge services, which provided us with detailed and helpful information ahead of time and were always ready to assist during our stay. However, there were a few hiccups, such as the absence of easily accessible vending machines in the hotel. Despite these minor inconveniences, the positives of the Mayflower Park Hotel, particularly the cleanliness and overall sleep quality, outweighed the negatives, making it a place I would consider staying at again.","['Value', 'Sleep Quality']","['Cleanliness', 'Sleep Quality']",100542,"The Mayflower Park Hotel in Seattle offers beautifully refurbished rooms with excellent cleanliness, comfortable beds, and a central location for exploring the city on foot. While pricing concerns and issues with noise disruptions and room size have been noted, the hotel's friendly staff, charming lobby, and dedication to cleanliness make it a worthwhile option for guests prioritizing cleanliness and sleep quality. Despite some drawbacks like small elevators, the hotel's positive highlights and convenient location contribute to a generally positive guest experience.","The Mayflower Park Hotel offers a blend of pros and cons, with beautifully refurbished interiors and a prime central location ideal for exploring Seattle. Despite the clean and well-appointed rooms, issues such as small room size, thin walls, firm bedding, and cramped bathrooms negatively impact sleep quality and overall comfort. While the friendly staff, charming lobby, and enjoyable on-site bar and restaurant stand out, the high prices and slow elevators make the hotel's value for money questionable, prompting some guests to consider other options for future visits.","During my stay at the Mayflower Park Hotel, I had a mixed experience that encompassed various aspects. The rooms were nicely appointed and clean, but on the smaller side with a cramped bathroom, leading to some discomfort. The pricing felt steep, which contributed to the overall value-for-money concern during my stay. The thin walls were a significant issue as I could hear noise from adjacent rooms, impacting my sleep quality on a firm bed. Despite these drawbacks, the central location proved to be convenient for exploring Seattle's attractions. The staff stood out with their friendliness and knowledge, while Oliver's bar offered a fun atmosphere and the restaurant served delicious food at reasonable prices. However, the small elevators posed a challenge, particularly during peak times. On the cleanliness front, the hotel impressed with impeccably clean rooms and diligent housekeeping, which contributed significantly to the overall comfort. The sleep quality, although somewhat affected by noise, was generally good, with a comfortable bed despite soft pillows. The helpful concierge services and central location further added to the positive aspects of my stay, outweighing minor inconveniences like the absence of easily accessible vending machines. While some details need improvement, such as room size and noise insulation, the experience at the Mayflower Park Hotel had its highlights and drawbacks, making it a nuanced choice for future stays in Seattle.",,,,,,,,,,,,,,,,,,,,,
9,9,"I booked a stay at the Moore Hotel based on its excellent location and affordability for a four-night stay in Seattle, but I was pretty disappointed with some of the aspects, particularly regarding cleanliness. The bathroom, in particular, was a letdown as there was noticeable mildew around the shower edges likely due to the slow-draining shower stall, which also led to frequent water overflow onto the floor. This was quite unpleasant and really needs immediate attention. The room itself, while spacious and offering a great view of downtown and Puget Sound, was not without issues. The sink in our room had no hot water pressure, which made it inconvenient to use. There was also no full-length mirror or clock, which are pretty basic amenities that could have been easily provided. However, the hotel has its charms, with its historic details like tall ceilings, wide hallways, and exposed woodwork. The rooms are equipped with new lamps, beds, and a TV, which is a nice touch. Unfortunately, the old elevator was rickety and unnerving to use. 

On a more positive note, the location is unbeatable, just a short walk from Pike Place Market, bus stations, and numerous cafes, bars, and shops. The staff were incredibly friendly and helpful, and the neighborhood, although a bit sketchy in parts, felt relatively safe overall. Public transportation options around the hotel are convenient, making it easy to get around without a car. The clientele is quite mixed, with both young international travelers and older visitors, and the vibe is welcoming. The hotel also features wireless access in the lobby and offers useful tourist information. While the maintenance of the bathroom and the room left a lot to be desired, the character and charm of the hotel, combined with its excellent location and helpful staff, made it an overall decent stay. If they improve on the cleanliness and maintain their facilities better, it could be a fantastic place to stay in Seattle.","I recently stayed at The Moore Hotel for a few nights while visiting Seattle, and overall, I had a great experience primarily due to the exceptional service and cozy rooms. The staff at the front desk were some of the friendliest and most helpful I've encountered—they went out of their way to make sure my stay was comfortable. From providing detailed verbal descriptions of room options to sharing valuable recommendations on local eateries and helping polish off a birthday cake, their hospitality was top-notch. I especially appreciated the booking experience over the phone, which was smooth and pleasant.

Regarding the rooms, they were basic yet clean, which is important to me. Our room had high ceilings and large windows that allowed a nice breeze since there was no air conditioning. The rooms might not have had modern décor, but they maintained a charming, old-time ambiance reminiscent of European hotels. The bed was comfortable, and the room had nice touches like a small table by the window where I could enjoy a bit of the waterfront view. Although the bathroom was small and the shower a bit temperamental temperature-wise, it was clean and functional for a brief stay.

The hotel’s great location can't be understated—just a couple of blocks from Pike Place Market and within easy walking distance to shopping areas. Despite some reviews mentioning noise from the street and nearby theaters, we faced less disturbance by staying on a higher floor and using a fan for white noise. I felt safe throughout my stay even when encountering street people in the area; they were harmless and didn’t bother us.

Considering the rate and the level of service, The Moore Hotel is an excellent choice for budget travelers looking for a convenient, clean, and friendly place to stay in the heart of Seattle. I would definitely stay here again and recommend it to anyone looking for good value accommodation in Seattle.","['Cleanliness', 'Rooms']","['Service', 'Rooms']",100544,"The Moore Hotel in Seattle offers affordable accommodations with a historic charm and cozy atmosphere near Pike Place Market, combined with helpful and friendly staff providing excellent service. While some guests noted cleanliness and maintenance issues like mildew, slow-draining showers, and low hot water pressure, improvements in these areas could make it a fantastic choice for budget travelers seeking quality service and convenience in Seattle. Despite these drawbacks, the hotel's excellent location, character, and dedicated staff make it a feasible option for those prioritizing room quality and sleep in a convenient location.","The Moore Hotel in Seattle offers an excellent location and affordability, though it has notable shortcomings in cleanliness and maintenance, with issues like mildew in the bathroom, low hot water pressure, and lacking basic amenities such as a full-length mirror and clock. Despite these drawbacks, the hotel charms with its historic details, friendly and helpful staff, and convenient access to public transportation, Pike Place Market, and local eateries. The rooms are basic yet clean, with comfortable beds and old-school ambiance, making it a decent budget choice if improvements are made in cleanliness and maintenance.","During my stay at The Moore Hotel in Seattle, I had a mixed experience. The hotel's location was undeniably great, just a short walk from Pike Place Market and various attractions. The staff was incredibly friendly and helpful, providing valuable recommendations and excellent service. However, there were notable drawbacks, particularly regarding cleanliness. The bathroom had issues with mildew and slow-draining shower stall, leading to water overflow, but the room itself was cozy and clean, embracing an old-time charm with high ceilings and large windows. The lack of hot water pressure in the sink and missing amenities were inconvenient, highlighting the need for maintenance improvements. Despite some noise from the surroundings, I felt safe and appreciated the convenient public transportation options. While the character of the hotel and its historic details were enjoyable, potential issues like the rickety elevator raised concerns. Overall, though there is room for enhancement, The Moore Hotel offers a decent stay with its friendly staff, good value for budget travelers, and an unbeatable location in Seattle.",,,,,,,,,,,,,,,,,,,,,
10,10,"During my recent stay at the Hotel Pacific in Seattle, I found myself quite disappointed with certain aspects of the experience, particularly regarding cleanliness and the check-in process. As much as I was looking for a bargain in downtown Seattle, I did not anticipate having to deal with dusty surfaces everywhere, especially on the bathroom shelves. Additionally, it seemed the hotel could do with a thorough cleaning from top to bottom, as even the light fixtures in the lobby had a visible layer of dust. While these may not be deal breakers for everyone, they certainly detracted from my overall comfort. The check-in process also left much to be desired. Despite being excited to start my stay, the front desk experience wasn't as smooth as I hoped, adding unnecessary frustration after a long trip. That said, there are some positive notes to mention. The location of the hotel is fantastic, making it easy to explore shopping areas and Pike’s Market on foot. The room, albeit small, was equipped with a comfortable bed and quiet surroundings, which was a relief after hectic days. The mezzanine ""living room"" area with free Wi-Fi was a pleasant spot to relax, especially given the small size of the rooms. It's a mixed bag, but if cleanliness and an efficient check-in process are high on your priority list, you might want to look elsewhere.","During my recent stay at this hotel, I was pleasantly surprised by the high level of comfort provided by the bed, which contributed significantly to my overall sleep quality. Despite the small size of the rooms, the bed was incredibly cozy, boasting thin but warm covers that kept me comfortable throughout the night. Arriving early after a long journey, the front desk staff couldn't have been more accommodating, allowing us to check in early on a rainy day, which was greatly appreciated. Moreover, the bellhop was friendly and eager to assist with our bags. The hotel's location is in the heart of downtown, making it a convenient spot for exploring the area, although maneuvering a car about town was a bit of a challenge. The staff were consistently friendly and made genuine efforts to ensure guests were happy. Despite a few quirks typical of an old building, like small bathrooms and some street noise, it's evident that the hotel is maintained with care. Additional perks, such as a complimentary wine social hour in the afternoon, where the manager personally greets guests, added a unique and personal touch. While there were some minor inconveniences, like the small size of the bathroom and occasional thin walls, the positives, particularly the excellent sleep quality and accommodating front desk, made for a generally pleasant stay.","['Cleanliness', 'Check in / front desk']","['Sleep Quality', 'Check in / front desk']",100547,"The Hotel Pacific in Seattle offers a mixed experience with a fantastic location and comfortable amenities like a cozy bed and free Wi-Fi, but falls short in terms of cleanliness and smooth check-in process. Despite some minor inconveniences, such as small bathrooms and occasional noise, the excellent sleep quality and accommodating front desk make for a generally pleasant stay. If cleanliness and a smooth check-in process are priorities, exploring other options may be worth considering.","During my stay at the Hotel Pacific in Seattle, I was disappointed with the cleanliness and inefficient check-in process, despite its great downtown location. The dusty surfaces, including the bathroom shelves and lobby light fixtures, detracted from the overall comfort, though the bed was cozy, and the small rooms provided quiet surroundings. Positives included friendly staff, an early check-in accommodation, a convenient location for exploring, and perks like a complimentary wine social hour, making it generally pleasant despite minor issues like small bathrooms and some street noise.","During my recent stay at the Hotel Pacific in Seattle, I encountered a mix of experiences that shaped my overall impression. Upon check-in, I shared the concerns of one guest about cleanliness, noting dusty surfaces in the room and lobby, alongside an inefficient check-in process. However, I also shared the positive surprise of another guest regarding the high comfort levels provided by the cozy bed, contributing to a good night's sleep. Although the small size of the rooms was a common issue, the convenient downtown location allowed for easy exploration of the city's attractions. While some quirks like noise levels were present, the attentive staff, including an accommodating front desk team and friendly bellhop, enhanced my stay. Despite areas that could be improved, such as bathroom size and cleanliness, the personal touch of a complimentary wine social hour and the meticulous care in hotel maintenance were notable. In conclusion, the Hotel Pacific provides a generally pleasant experience with highlights in service quality and sleep comfort, although enhancements in cleanliness and front desk efficiency could elevate the overall guest satisfaction level.",,,,,,,,,,,,,,,,,,,,,