,Unnamed: 0,rev_neg,rev_pos,attr_neg,attr_pos,cls,multiagent_summary,writer_critic_summary,collaborative_summary,,,,,,,,,,,,,,,,,,,,,
0,0,"During our recent stay at the Alexis Hotel, we encountered several disappointing aspects that greatly impacted our overall experience, particularly in terms of value and sleep quality. For starters, given the steep price of over $340 per night, we expected top-notch service and amenities, but were met with mediocre service that seemed more fitting for a budget chain. While the location is indeed central, allowing easy access to attractions like Pioneer Square and Pike Place Market, the high cost did not justify the quality of service received. Waiting nearly two hours for an ice bucket, having our car lost for 20 minutes in the garage, and the dismissive attitude from the reception when we complained was unacceptable.

Sleep quality was another major issue. Despite the spacious and clean room, our nights were anything but restful. We were placed in a section of the hotel adjacent to a boisterous wedding party, resulting in hours of screaming and door banging that persisted well past midnight. Although we called the front desk for help, the response was delayed and ineffective; even after confirmation from security that they heard nothing. A complimentary bottle of wine and cheese plate the next night, though a nice gesture, did little to make up for the disrupted rest we endured. 

On a positive note, the staff were generally friendly and knowledgeable about the local area, offering helpful suggestions for sightseeing and dining. The hotel itself is lovely, with creatively designed suites that were large and comfortable. Breakfast in ""The Library"" was delicious and the happy hour was a nice touch after a day of exploring the city. 

However, the blend of subpar service and disrupted sleep, especially at such a high cost, left us with a sense of frustration. While there were aspects of the Alexis Hotel that we did enjoy, the overall experience fell short of our expectations, particularly in terms of value and quality of sleep.","During my recent stay at the hotel, I was pleasantly surprised by the exceptional service and great value. The staff were incredibly helpful and kind throughout my visit, always going out of their way to accommodate my requests, which made a significant difference in my overall experience. The front desk team was exceptional, always friendly and professional, even when I arrived late at night. This level of attention didn’t go unnoticed, and it was clear they genuinely cared about the guests.

I was thrilled when we were upgraded to a larger room upon arrival; it made our stay even more enjoyable. Despite some minor noise from the hallway and street, the room was well-appointed and comfortable. The hotel's great location allowed easy access to local attractions and restaurants. The dining credit included in our deal was a nice touch, and while there were some hiccups like the restaurant being closed, the staff swiftly addressed our concerns and even comped our dinner, which I thought was a fair gesture.

The value for money was also impressive considering the quality of the service and the comfort provided. For the price, the hotel delivered a satisfying experience, especially given its prime location near landmarks and shopping areas. Though some aspects of the property could benefit from renovations, the cleanliness and the friendliness of the staff made up for it. We also appreciated the independent spa attached to the hotel, although I’d recommend inquiring about the specifics of the services provided for a better experience.

Overall, while the hotel isn’t the highest tier of luxury, the excellent service and good value made for a pleasant stay. The friendly demeanor of the staff and the added perks, like room upgrades and dining credits, really enhanced our visit. It’s a great place to stay if you prioritize service and are looking for good value in a convenient location.","['Value', 'Sleep Quality']","['Service', 'Value']",112412,"During stays at the Alexis Hotel, guests had mixed experiences. Some encountered disappointing service and sleep quality, with delays and noise disruptions overshadowing positive aspects like friendly staff and creatively designed suites. However, others praised exceptional service, room upgrades, and good value for money, highlighting positive interactions with staff and the convenient location near local attractions and dining options. Overall, opinions varied on the hotel, with some feeling frustrated by the high cost not matching the quality received, while others enjoyed a satisfactory stay with excellent service and value.","During our stay at the Alexis Hotel, we experienced several disappointing aspects, notably poor service and disrupted sleep, that did not justify the $340 per night cost. Despite its central location and lovely, creatively designed suites, service issues such as a nearly two-hour wait for an ice bucket and a noisy night owing to a wedding party greatly detracted from our overall experience. While the staff were generally friendly and knowledgeable, the overall quality and value did not meet our expectations, although some other guests found the service exceptional and appreciated perks like room upgrades and dining credits.","My stay at the Alexis Hotel was a mixed experience. The hotel's location was central, providing easy access to attractions like Pioneer Square and Pike Place Market, but the noise from a nearby event disrupted my sleep quality. The room, although spacious and clean, felt a bit outdated and could have been more soundproof. I encountered subpar service with delays in receiving amenities and a dismissive attitude from the staff, which impacted the overall value of my stay, especially considering the high cost. However, the staff were generally friendly and knowledgeable, offering helpful suggestions for sightseeing, and the breakfast in ""The Library"" was delicious. I appreciated the efforts to address concerns by offering a complimentary bottle of wine and cheese plate. On the other hand, another guest had a more positive experience, emphasizing the exceptional service, great value for money, and friendly staff who accommodated requests with professionalism. Their room upgrade and dining credit enhanced their stay, despite minor noise disturbances. The contrasting perspectives highlighted the inconsistencies in the hotel's service and value, showcasing varying experiences guests may encounter. Overall, my stay had its ups and downs, with aspects that fell short of expectations in terms of service and sleep quality, but the convenient location and pleasant staff interactions added some positivity to the experience.",,,,,,,,,,,,,,,,,,,,,
1,1,"I recently stayed at the Fairmont for five days in November during a conference, and while the location is undoubtedly superb, I am disappointed to report several issues primarily related to cleanliness and the check-in experience. Upon entering my room, I noticed the floors were dirty, and the cleaning staff seemed to do the bare minimum throughout my stay. There were scuff marks on the walls and in the room, and the air and heating unit didn’t circulate air properly, making for an uncomfortable stay.

The check-in process was also less than ideal. Despite having reserved my room months in advance and confirming it the night before, my booking seemed to be disregarded. I experienced a long and arduous check-in, and the room I had specifically requested was unavailable, which made me feel undervalued as a returning guest. This was particularly frustrating as I recalled a much more seamless and accommodating check-in process from my previous visit.

Despite these negatives, there were some redeeming qualities. The room layout could have been better given the poorly oriented plasma TV, but the housekeeping, doormen, and bellhops provided excellent service. Room service was prompt, even though the food did not meet my expectations. However, there was no coffee pot in the room or complimentary coffee in the lobby. As a coffee addict, this meant inconveniently having to go to the gift shop each morning rather than enjoying a simple brew in my room.

Overall, although the location and some aspects of service retained their charm, the diminished cleanliness standards and frustrating check-in experience overshadowed what could have been another delightful stay.","I recently stayed at the Fairmont Chicago and my overall experience was quite positive, particularly when it came to cleanliness and value. The room was impeccably clean and the housekeeping staff did a wonderful job maintaining it throughout my stay. The bathroom was particularly impressive, with a separate shower and tub, and everything was spotless. I really appreciated the large flat screen TV and comfortable bedding, which added to the overall pleasant experience. On the value front, I was pleased with the rate I managed to get, which seemed very reasonable considering the location and the quality of the room. The central location made it easy to access Millennium Park and other downtown attractions, which was extremely convenient. The concierge service recommended some great restaurants and activities, and the valets were extremely friendly and helpful. While there were some minor issues like the thin walls and occasional noise from the adjoining rooms, these did not significantly detract from my stay. Additionally, amenities like WiFi and parking were a bit pricey, but this is somewhat expected for a downtown hotel. Despite these small drawbacks, I found the Fairmont Chicago to provide good value for the money, coupled with excellent cleanliness standards. Overall, I would consider staying here again for the balance of cleanliness, value, and location.","['Cleanliness', 'Check in / front desk']","['Cleanliness', 'Value']",114577,"The Fairmont Chicago received mixed reviews, with some guests reporting cleanliness issues and challenging check-in experiences, while others praised the impeccable cleanliness, value for money, and convenient location of the hotel. Despite some minor drawbacks like noise from adjoining rooms and expensive amenities, both positive and negative aspects impacted guests' overall satisfaction with their accommodations and services at the Fairmont Chicago. Overall, while some aspects were disappointing, the hotel's charm and service quality made up for certain shortcomings, with special mention of cleanliness, value, and location.","During a five-day conference stay at the Fairmont in November, I found the location superb but faced issues with cleanliness and check-in, including dirty floors and scuff marks, and a problematic air unit, as well as a long, arduous check-in despite reserving months in advance. While the housekeeping, doormen, and bellhops offered excellent service, the room layout was awkward, room service food was subpar, and there was no in-room or lobby coffee, which was inconvenient. Overall, while the location and some service aspects were charming, the compromised cleanliness standards and check-in difficulties overshadowed what could have been a delightful stay.","During my recent stay at the Fairmont, I had a mixed experience. The hotel's central location was convenient for exploring the city, and the housekeeping staff provided excellent service in maintaining cleanliness. However, I was disappointed by the cleanliness issues in the room, such as dirty floors and scuff marks on the walls, which detracted from the overall experience. The check-in process was also challenging, with a long wait and the unavailability of my requested room, leaving me feeling undervalued as a returning guest. While the room layout and amenities were satisfactory, the lack of in-room coffee and inadequate air circulation were drawbacks. On the positive side, the friendly concierge service and helpful valets added to my stay. Despite the hotel's redeeming qualities, the cleanliness standards and frustrating check-in experience overshadowed the potential for a delightful stay, making me consider other options for future visits.",,,,,,,,,,,,,,,,,,,,,
2,2,"My recent stay at the hotel had its ups and downs, particularly with the service and the rooms. Starting with the service, it was undeniably subpar. The staff at the front desk and during breakfast hours were unfriendly and unhelpful. When I had an early morning departure, merely five minutes past the breakfast start time, the staff showed no consideration and didn't even offer a simple fruit or snack for the road. Additionally, requesting the valet service was another ordeal where my car was brought 20 minutes early, and the valet seemed annoyed that I wasn't ready to leave instantly. This lackadaisical and insensitive service was a major letdown, especially in a city as bustling as Chicago.

As for the rooms, while generally clean and reasonably quiet, they weren't free from issues. We could hear outside noise from traffic and ambulances quite clearly, which, although not a huge problem for me as I sleep heavily, could be a bother for lighter sleepers. Despite these downsides, there were some positives that shouldn’t be overlooked. The hotel's location is fantastic, being just a short walk from LaSalle Station and near major attractions like the Shedd Aquarium. The historical charm of the old printing factory building provided a unique vibe compared to generic mega-hotels. Free Wi-Fi was a pleasant bonus, and the surrounding dining options, like Potbelly's and Starbucks, added convenience. However, considering the poor service experience, I would probably think twice before staying here again.","During my recent stay at Hotel Blake, I was genuinely impressed by their outstanding service. The staff went above and beyond to ensure our visit was pleasant. They were always friendly, polite, and very responsive to our needs. For instance, when we requested an extra blanket late at night, they delivered it promptly, showing great kindness and professionalism. This level of service is what makes Hotel Blake stand out. Showtime, one of the doormen, despite receiving mixed feedback from other guests, added a unique charm to our stay with his lively demeanor. Additionally, the continental breakfast in the lobby, while not extensive, was a nice touch and made our mornings more convenient. 

As for the sleep quality, I have to say that I was quite pleased. The pillowtop beds and high-quality sheets provided a comfortable night's sleep, and despite some noise from the streets, it wasn’t too disruptive even on the lower floors. Our room was spacious with ample space to sit and relax, and the bedding on the king-size bed was exceptionally cozy and warm. 

The location is unbeatable, with easy access to Grant Park, Michigan Avenue, and Museum Campus, which made exploring the city a breeze. Despite some minor issues like dusty vents and occasional internet connectivity problems, the overall ambiance and cleanliness of the hotel were satisfactory. The public parking nearby was also a convenient option, and far more affordable than the hotel's parking rates.

In summary, while there are areas for improvement, particularly in room maintenance, the exceptional service and comfortable sleep quality made our stay at Hotel Blake a positive experience.","['Service', 'Rooms']","['Service', 'Sleep Quality']",114578,"Despite noise issues and subpar service at the first hotel in Chicago, its historical charm and convenient location were overshadowed by the poor service experience. In contrast, Hotel Blake impressed with outstanding service, comfortable sleep quality, and a prime location near major attractions, making it a standout choice despite minor room maintenance concerns. The exceptional service, cozy atmosphere, and convenient location at Hotel Blake provided a pleasant and restful stay, surpassing the shortcomings of the first hotel.","My recent stay at Hotel Blake had mixed experiences; while the service was subpar, with unfriendly front desk and breakfast staff, and an unhelpful valet service, the hotel's prime location, near LaSalle Station and major attractions, added charm. Despite issues like outside noise and dusty vents, the comfortable pillowtop beds, cozy bedding, and spacious rooms ensured a decent sleep quality. The historical charm of the building, complimentary Wi-Fi, and surrounding dining options were highlights, but the poor service might make me reconsider staying there again.","During my stay at Hotel Blake, I had a mix of experiences that offered diverse perspectives on the hotel. The service was a significant factor in determining my overall impression, with one review pointing out unfriendly and unhelpful staff, while the other praised the outstanding service, showing kindness and professionalism in meeting guest needs. The room quality also varied, as one guest mentioned noise issues and cleanliness concerns, while the other enjoyed a comfortable sleep experience with cozy bedding and great sleep quality. The convenient location near major attractions and the historical charm of the building added a unique touch to the stay. However, the conflicting perspectives on service and room quality provide a clear indication of the varying experiences one might encounter at Hotel Blake, making it a nuanced choice for future stays.",,,,,,,,,,,,,,,,,,,,,
3,3,"I recently stayed at this hotel and had a very mixed experience. The cleanliness was a significant issue for me. Upon arrival, I noticed a ketchup packet under the chair, trash behind the curtain, and sheets with holes in them. The shelves under the TV were covered in dust, and there were even some signs of wear and tear, like a broken minibar hinge and a chewed-up bathroom door. Worse, there was mold in the shower around the base and eye level, which I found quite off-putting. The cleanliness issues really detracted from what could have been a pleasant stay.

As for value, I felt the hotel was way overpriced for what it offered. Paying over $200 per night, then having to shell out additional fees for basic amenities like using the pool and gym ($16 and $25 per day respectively), Wi-Fi ($10/day), and even parking ($52/day) felt like I was being nickel-and-dimed at every turn. The in-room bottled water was $11, and breakfast was incredibly pricey. Despite these drawbacks, the location was fantastic, being close to Navy Pier and the Mag Mile, and the views from my room were breathtaking, especially the sunrise over Lake Michigan.

The staff were mostly kind and helpful, particularly the concierge, who provided excellent service even if they were often busy with other guests. Customer service in the conference rooms was also top-notch. However, some encounters at the front desk were less than friendly, and there were hiccups with mini-bar charges and engineering interruptions. The room itself had a decent decor but definitely lacked a luxurious feel, and the lobby area was always crowded and noisy.

Overall, the hotel does some things well, but the extra charges and cleanliness issues make it hard to justify the steep price. While the location and views are definite perks, the overall experience fell short of expectations for a hotel claiming a high-star rating.","My stay at the Swissotel in Chicago was a mixed experience, but overall I feel that I got great value for the price paid. I booked a room through Priceline for $90 per night, and for that rate, the quality was impressive. The room was clean, spacious, and modern, and I had a beautiful view of the city from a high floor, which added to the overall experience. The bed and pillows were extremely comfortable, leading to what was perhaps the best sleep I’ve ever had in a hotel. The air conditioning was set at a comfortable 72°F, making the room a very pleasant environment.

On the downside, like many reviewers noted, the hotel does like to charge for everything extra, which can add up quickly. I had to pay for internet access and the pool, which seemed a bit much considering the already high room rates. There were also some service hiccups; the hotel was overbooked and we had to spend the first night in a nearby hotel. While Swissotel covered the cost for that night, it was still inconvenient having to move around. The staff’s response to this issue was less than satisfactory, and it took several calls and emails to get a proper resolution.

Despite these setbacks, the hotel’s central location made it easy to explore nearby attractions like Navy Pier and Millennium Park. The bathrooms were clean and well-equipped, and overall, the room was quiet, which contributed to a good night’s sleep. The customer service was a bit hit or miss—some staff were friendly and helpful, while others were less engaging.

Breakfast at the hotel restaurant was also quite good, although a bit on the pricier side. Once again, this was a matter of balancing the cost with the value received, and for what we ended up paying, it was worth it. If I could secure the same deal again, I would consider staying here, primarily for the fantastic bed and convenient location.","['Cleanliness', 'Value']","['Value', 'Sleep Quality']",114581,"This collection of articles delves into two contrasting hotel experiences in Chicago, where one faced cleanliness issues, hidden fees, and inconsistent service, while the other offered great value with clean, modern rooms, comfortable amenities, and a central location. The comparison underscores the importance of cleanliness, amenities, pricing, and overall experience in hotel accommodations, highlighting the balance between affordability and quality service.","During my recent stay at this hotel, the cleanliness was a major concern, with issues like a ketchup packet under the chair, dust-covered shelves, and mold in the shower, significantly detracting from the experience. While the location near Navy Pier and the Mag Mile offered breathtaking views, the steep extra charges for amenities and basic services like Wi-Fi and parking made the hotel feel overpriced. Although the staff, especially the concierge, provided excellent customer service, some front desk interactions were disappointing, and the overall ambiance lacked the luxury expected from a high-star rating, making it difficult to justify the cost.","During my recent stay at the hotel, I encountered a mix of positive and negative aspects that shaped my overall experience. The room I stayed in had significant cleanliness issues, including trash, dust, and even mold in the shower, which unfortunately detracted from the potential comfort of the stay. Additionally, I found the additional charges for basic amenities like Wi-Fi and parking to be excessive, adding to the already high cost of the room. Despite these drawbacks, the central location of the hotel near Navy Pier and the Magnificent Mile provided breathtaking views and easy access to explore the city. The staff members varied in their friendliness and effectiveness, with service quality differing between encounters. Although there were some highlights like the comfortable bed and well-equipped bathrooms, the notable cleanliness issues and excessive charges made it challenging to fully enjoy the stay. Overall, my experience at the hotel was a mixed bag, with both positives and negatives defining the quality of my stay.",,,,,,,,,,,,,,,,,,,,,
